{
    "account_number": "1234567890",
    "type": "savings",
    "frequency": "monthly",
    "data": [
        {
            "date": "2023-01-01",
            "amount": 2518.16,
            "changeFromLastMonth": 0
        },
        {
            "date": "2023-02-01",
            "amount": 3422.69,
            "changeFromLastMonth": 904.53
        },
        {
            "date": "2023-03-01",
            "amount": 4241.39,
            "changeFromLastMonth": 818.7
        },
        {
            "date": "2023-04-01",
            "amount": 5155.14,
            "changeFromLastMonth": 913.75
        },
        {
            "date": "2023-05-01",
            "amount": 6016.09,
            "changeFromLastMonth": 860.95
        },
        {
            "date": "2023-06-01",
            "amount": 6924.24,
            "changeFromLastMonth": 908.15
        },
        {
            "date": "2023-07-01",
            "amount": 7845.09,
            "changeFromLastMonth": 920.85
        },
        {
            "date": "2023-08-01",
            "amount": 8741.37,
            "changeFromLastMonth": 896.28
        },
        {
            "date": "2023-09-01",
            "amount": 9732.43,
            "changeFromLastMonth": 991.06
        },
        {
            "date": "2023-10-01",
            "amount": 10569.8,
            "changeFromLastMonth": 837.37
        }
    ]
}